{"annotations":{"buildRunId":"scale-v2-conformance-fixture","createdAt":"2026-07-31T12:00:00Z","emissionPolicyOwner":"unassigned","releaseStatus":"fixture"},"content":{"assignmentPolicy":{"candidateMethodId":"urn:rulespec:fixture:candidate-method:known-concept-v1","emissionPolicyId":"urn:platform:unowned:emission-policy:fixture-v1","policyId":"urn:rulespec:fixture:assignment-policy:scale-v2","policySha256":"67e5c4613430d5a7d844e81d8f933611addf49a3223074dafe6c8e2dfb81cd2a","qualificationProtocolId":"urn:rulespec:fixture:qualification:two-validator-v1"},"counts":{"abstainedDocumentCount":1,"activeDocumentCount":4,"assignedDocumentCount":1,"assignmentCount":1,"assignmentEvidenceCount":12,"buildReceiptCount":1,"coverageRecordCount":1,"excludedDocumentCount":1,"failedDocumentCount":1,"memberCount":14,"partitionManifestCount":4,"totalMemberByteSize":53917},"globalManifest":{"byteSize":3119,"manifestId":"global:global","objectKey":"manifests/global.json","scopeId":"global","scopeKind":"global","sha256":"aeb45ae17c17ce28c64daa4ca2a5cf0ecd350eff22966920d7ff24e2ca79930d"},"input_releases":{"document_release":{"release_digest":"sha256:6782ade513917b0285c59e861c6b0e94446a5618dc8a1ae769af7344821ad2bb","release_id":"urn:spicyregs:document-release:v3:6782ade513917b0285c59e861c6b0e94446a5618dc8a1ae769af7344821ad2bb"},"reference_resource_release":{"release_digest":"sha256:1c58375fc2c0c0d06898d6437101bce6b2beb5ed8c641287fd974a8f47560f4a","release_id":"urn:ref:federal-register-thesaurus:2025-04-01:reference-resource-release:v1"},"rulespec_core_release":{"release_digest":"sha256:6c68e2b82d670045654fe08c890af2f12bca96c96cc1e9c9a02a1008f1817d62","release_id":"urn:rulespec:core:6c68e2b82d670045654fe08c890af2f12bca96c96cc1e9c9a02a1008f1817d62"},"vocabulary_atlas_asset":{"asset_id":"urn:rulespec:atlas-membership-stub:01944aecdd3fe9ce7ab3b7215f982f9fb4e077e70c99634b6bd795e92dbd5651","distribution_digest":"sha256:65eabfbb5b07f8a1d8f1ec3701f4a36b7dfd7acd66a120a544ab81849517e955","manifest_digest":"sha256:986fe117c5423fdb58771cea4b95dad883bf09f892d24bee6c81f8fc57496bc6"}},"partitionManifests":[{"byteSize":1403,"manifestId":"partition:0000","objectKey":"manifests/partition-0000.json","scopeId":"0000","scopeKind":"partition","sha256":"20634de71704fbd84a307f3b7ed9c1780866f17b9f40e852c0d0b8175fa56c18"},{"byteSize":627,"manifestId":"partition:0001","objectKey":"manifests/partition-0001.json","scopeId":"0001","scopeKind":"partition","sha256":"131d5eb0ee78988893a93e21c10276ccf40d8d1cbb9bdb745a7c2923a6ca9943"},{"byteSize":627,"manifestId":"partition:0002","objectKey":"manifests/partition-0002.json","scopeId":"0002","scopeKind":"partition","sha256":"495347ef279edbf5d6516bef2807220f572e8c64695fb39bd22579ecd98c4844"},{"byteSize":627,"manifestId":"partition:0003","objectKey":"manifests/partition-0003.json","scopeId":"0003","scopeKind":"partition","sha256":"2f6b68a33fbd1c9e42e284f7fb13be6f1d7bfeedfdd8bd1dad6e1594d28d0c4b"}],"producer":{"implementationId":"rulespec-reference-fixture-builder","implementationVersion":"2.0-fixture","product":"rulespec-extrapolator","runtimeProfileId":"local-fixture","sourceRevision":null},"profile":{"profile_id":"urn:rulespec:profile:search-only-concept-extraction","profile_version":"2","usage_cap":"searchOnly"},"schemaSet":{"schemaSetId":"urn:spicy:schema-set:v1:7f6520164fd9a8cf90c44cae397be0f700e980897a07888f3b53ff85d9876abb","schemas":[{"roles":["schema"],"schemaId":"https://rulespec.org/schemas/releases/extrapolation-release-v2.schema.json","schemaSha256":"6338275cbcc476521267a4b06731fb80700dbe6714b1e15d4c0101f9ab272af5","schemaVersion":"1.0"},{"roles":["assignment-dispositions"],"schemaId":"https://rulespec.org/schemas/releases/extrapolation-release-v2/assignment-dispositions-v1.schema.json","schemaSha256":"18c67812e4722e1a41fe979b9972de6b20d2af0125cadd70bebbbce08db50abc","schemaVersion":"1.0"},{"roles":["assignment-evidence"],"schemaId":"https://rulespec.org/schemas/releases/extrapolation-release-v2/assignment-evidence-v1.schema.json","schemaSha256":"480f9648b90d58dcbb8d6a613ee5c29e23262379667032236465507fc454e3ad","schemaVersion":"1.0"},{"roles":["assignments"],"schemaId":"https://rulespec.org/schemas/releases/extrapolation-release-v2/assignments-v1.schema.json","schemaSha256":"2f1043a141e9677e991882b572d6d6b35e67c985cddc3a9cb7231933d02f1b92","schemaVersion":"1.0"},{"roles":["build-receipt"],"schemaId":"https://rulespec.org/schemas/releases/extrapolation-release-v2/build-receipt-v1.schema.json","schemaSha256":"7ab18fac257fa420a348be8464e98c60a7b06da598425c2b7337c20bc7e25a9b","schemaVersion":"1.0"},{"roles":["coverage"],"schemaId":"https://rulespec.org/schemas/releases/extrapolation-release-v2/coverage-v1.schema.json","schemaSha256":"5cc5f3063297f989e153bf7e292057f96f26172da498f48453c7a4508d4f3f76","schemaVersion":"1.0"}]},"selection_context_digest":"sha256:f833d081c6299e7ac7726ba60b44a0451f77f3c5f95a59f693c21736488e3e5a","validation_sample_manifest":{"manifest_digest":"sha256:3b1f09a685f67b0c3545a73277dae46634183bd4a26af969475a2c9c387025bd","record_refs":["urn:rulespec:concept-assignment:ef284e37d019f1c6e289de33a5517dba073e7fa7d40de6b43574d09f3283951f","urn:rulespec:evidence-binding:2a2187450e35f3a2367f69533a600be148a4318b3d86fd1b1fd3c5553b7ea73b","urn:rulespec:artifact:a5f76439b420e32f0805c54592ade11947154087160a9271fd8da114a1193427","urn:rulespec:artifact:dd6c887102789853892cfa318a30d06c9b3e0664b5cbde807af2148a2b1be500","urn:rulespec:artifact:b4de4a3d6eba3ab0544cef0fde492b95a2c8ac9b9eac6ee7d1dcb797ba02bc39","urn:spicyregs:passage:v3:2642fb949be368eeeead9313bf640e6dcbfbb417b1261b1ae5899e5ae56adcf2","urn:ref:federal-register-thesaurus:2025-04-01:concept:0570"]}},"format":"rulespec-extrapolation-release","formatVersion":"2.0","releaseId":"urn:rulespec:extrapolation:v2:b9389395c982a9ccfc43e3750bf8d47e3279fe5802f897768e1fd88965cbe5e4"}